{
  "generated": true,
  "generator": "trade-journal@0.1.0",
  "trades": [
    {
      "id": "wb-64128e3c0583",
      "ideaId": "wb-64128e3c0583",
      "account": "webull",
      "broker": "webull",
      "symbol": "PLMT",
      "underlying": "PLMT",
      "instrument": "stock",
      "leverage": 1,
      "direction": "long",
      "style": "day",
      "sameDay": true,
      "openedAt": "2025-01-15T09:45:05-05:00",
      "closedAt": "2025-01-15T15:59:59-05:00",
      "status": "closed",
      "maxPosition": 5,
      "openQty": 0,
      "unmatchedQty": 0,
      "avgEntry": 3,
      "avgExit": 3.1,
      "grossPnl": 0.5,
      "fees": 0,
      "netPnl": 0.5,
      "result": "win",
      "holdMinutes": 374.9,
      "fillIds": [
        "wb-64128e3c0583",
        "wb-796e2641b296"
      ],
      "avgCost": 3,
      "realizedPnl": 0.5,
      "events": [
        {
          "kind": "open",
          "at": "2025-01-15T09:45:05-05:00",
          "qty": 5,
          "price": 3
        },
        {
          "kind": "close",
          "at": "2025-01-15T15:59:59-05:00",
          "qty": 5,
          "price": 3.1,
          "realized": 0.5
        }
      ],
      "tags": [],
      "excluded": false
    },
    {
      "id": "sc-8eef435ae68a",
      "ideaId": "sc-8eef435ae68a",
      "account": "schwab-main",
      "broker": "schwab",
      "symbol": "SWGA",
      "underlying": "SWGA",
      "instrument": "stock",
      "leverage": 1,
      "direction": "long",
      "style": "swing",
      "sameDay": false,
      "openedAt": "2025-03-03T00:00:00-05:00",
      "closedAt": "2025-03-12T00:00:00-04:00",
      "status": "closed",
      "maxPosition": 20,
      "openQty": 0,
      "unmatchedQty": 0,
      "avgEntry": 12.5,
      "avgExit": 12.5,
      "grossPnl": 0,
      "fees": 0,
      "netPnl": 0,
      "result": "breakeven",
      "holdMinutes": null,
      "fillIds": [
        "sc-8eef435ae68a",
        "sc-5afd3a38a318",
        "sc-82a71973b1f7",
        "sc-96d35607db0f"
      ],
      "avgCost": 12.5,
      "realizedPnl": 0,
      "events": [
        {
          "kind": "open",
          "at": "2025-03-03T00:00:00-05:00",
          "qty": 10,
          "price": 12
        },
        {
          "kind": "add",
          "at": "2025-03-05T00:00:00-05:00",
          "qty": 10,
          "price": 13
        },
        {
          "kind": "trim",
          "at": "2025-03-07T00:00:00-05:00",
          "qty": 5,
          "price": 14,
          "realized": 7.5
        },
        {
          "kind": "close",
          "at": "2025-03-12T00:00:00-04:00",
          "qty": 15,
          "price": 12,
          "realized": -7.5
        }
      ],
      "tags": [],
      "excluded": false
    },
    {
      "id": "sc-48c4da81183b",
      "ideaId": "sc-48c4da81183b",
      "account": "schwab-main",
      "broker": "schwab",
      "symbol": "OLDP",
      "underlying": "OLDP",
      "instrument": "stock",
      "leverage": 1,
      "direction": "long",
      "style": "swing",
      "sameDay": true,
      "openedAt": "2025-03-06T00:00:00-05:00",
      "closedAt": "2025-03-06T00:00:00-05:00",
      "status": "unmatched",
      "maxPosition": 0,
      "openQty": 0,
      "unmatchedQty": 5,
      "avgEntry": 0,
      "avgExit": 8,
      "grossPnl": 0,
      "fees": 0,
      "netPnl": 0,
      "result": null,
      "holdMinutes": null,
      "fillIds": [
        "sc-48c4da81183b"
      ],
      "avgCost": 0,
      "realizedPnl": 0,
      "events": [
        {
          "kind": "close",
          "at": "2025-03-06T00:00:00-05:00",
          "qty": 5,
          "price": 8,
          "realized": 0
        }
      ],
      "tags": [],
      "excluded": false
    },
    {
      "id": "sc-fced7b6d3790",
      "ideaId": "sc-fced7b6d3790",
      "account": "schwab-main",
      "broker": "schwab",
      "symbol": "BIGF",
      "underlying": "BIGF",
      "instrument": "stock",
      "leverage": 1,
      "direction": "long",
      "style": "swing",
      "sameDay": false,
      "openedAt": "2025-03-10T00:00:00-04:00",
      "closedAt": "2025-03-11T00:00:00-04:00",
      "status": "closed",
      "maxPosition": 1,
      "openQty": 0,
      "unmatchedQty": 0,
      "avgEntry": 1234.5,
      "avgExit": 1240,
      "grossPnl": 5.5,
      "fees": 1.31,
      "netPnl": 4.19,
      "result": "win",
      "holdMinutes": null,
      "fillIds": [
        "sc-fced7b6d3790",
        "sc-ced09412e412"
      ],
      "avgCost": 1234.5,
      "realizedPnl": 4.19,
      "events": [
        {
          "kind": "open",
          "at": "2025-03-10T00:00:00-04:00",
          "qty": 1,
          "price": 1234.5,
          "fees": 0.65
        },
        {
          "kind": "close",
          "at": "2025-03-11T00:00:00-04:00",
          "qty": 1,
          "price": 1240,
          "realized": 4.84
        }
      ],
      "tags": [],
      "excluded": false
    },
    {
      "id": "wb-4fa89f0bc78f",
      "ideaId": "wb-4fa89f0bc78f",
      "account": "webull",
      "broker": "webull",
      "symbol": "ZZTA",
      "underlying": "ZZTA",
      "instrument": "stock",
      "leverage": 1,
      "direction": "long",
      "style": "day",
      "sameDay": true,
      "openedAt": "2025-03-10T09:31:05-04:00",
      "closedAt": "2025-03-10T09:52:00-04:00",
      "status": "closed",
      "maxPosition": 4,
      "openQty": 0,
      "unmatchedQty": 0,
      "avgEntry": 1.55,
      "avgExit": 1.725,
      "grossPnl": 0.7,
      "fees": 0,
      "netPnl": 0.7,
      "result": "win",
      "holdMinutes": 20.92,
      "fillIds": [
        "wb-4fa89f0bc78f",
        "wb-e85d7d8026de",
        "wb-222472a7a90e",
        "wb-5bf0fe72ba8c"
      ],
      "avgCost": 1.55,
      "realizedPnl": 0.7,
      "events": [
        {
          "kind": "open",
          "at": "2025-03-10T09:31:05-04:00",
          "qty": 2,
          "price": 1.5
        },
        {
          "kind": "add",
          "at": "2025-03-10T09:35:00-04:00",
          "qty": 2,
          "price": 1.6
        },
        {
          "kind": "trim",
          "at": "2025-03-10T09:40:00-04:00",
          "qty": 1,
          "price": 1.8,
          "realized": 0.25
        },
        {
          "kind": "close",
          "at": "2025-03-10T09:52:00-04:00",
          "qty": 3,
          "price": 1.7,
          "realized": 0.45
        }
      ],
      "tags": [],
      "excluded": false
    },
    {
      "id": "wb-1c16affd9a67",
      "ideaId": "wb-1c16affd9a67",
      "account": "webull",
      "broker": "webull",
      "symbol": "QXRB",
      "underlying": "QXRB",
      "instrument": "stock",
      "leverage": 1,
      "direction": "long",
      "style": "day",
      "sameDay": true,
      "openedAt": "2025-03-10T10:00:00-04:00",
      "closedAt": "2025-03-10T10:20:00-04:00",
      "status": "closed",
      "maxPosition": 3,
      "openQty": 0,
      "unmatchedQty": 0,
      "avgEntry": 2,
      "avgExit": 1.9,
      "grossPnl": -0.3,
      "fees": 0,
      "netPnl": -0.3,
      "result": "loss",
      "holdMinutes": 20,
      "fillIds": [
        "wb-1c16affd9a67",
        "wb-2ecbb51f7c46"
      ],
      "avgCost": 2,
      "realizedPnl": -0.3,
      "events": [
        {
          "kind": "open",
          "at": "2025-03-10T10:00:00-04:00",
          "qty": 3,
          "price": 2
        },
        {
          "kind": "close",
          "at": "2025-03-10T10:20:00-04:00",
          "qty": 3,
          "price": 1.9,
          "realized": -0.3
        }
      ],
      "tags": [],
      "excluded": false
    },
    {
      "id": "wb-1cdafff96e51",
      "ideaId": "wb-4fa89f0bc78f",
      "account": "webull",
      "broker": "webull",
      "symbol": "ZZTA",
      "underlying": "ZZTA",
      "instrument": "stock",
      "leverage": 1,
      "direction": "long",
      "style": "day",
      "sameDay": true,
      "openedAt": "2025-03-10T14:10:00-04:00",
      "closedAt": "2025-03-10T14:15:00-04:00",
      "status": "closed",
      "maxPosition": 1,
      "openQty": 0,
      "unmatchedQty": 0,
      "avgEntry": 1.65,
      "avgExit": 1.65,
      "grossPnl": 0,
      "fees": 0,
      "netPnl": 0,
      "result": "breakeven",
      "holdMinutes": 5,
      "fillIds": [
        "wb-1cdafff96e51",
        "wb-756bd1830494"
      ],
      "avgCost": 1.65,
      "realizedPnl": 0,
      "events": [
        {
          "kind": "open",
          "at": "2025-03-10T14:10:00-04:00",
          "qty": 1,
          "price": 1.65
        },
        {
          "kind": "close",
          "at": "2025-03-10T14:15:00-04:00",
          "qty": 1,
          "price": 1.65,
          "realized": 0
        }
      ],
      "tags": [],
      "excluded": false
    },
    {
      "id": "wb-6a72f40d4a17",
      "ideaId": "wb-6a72f40d4a17",
      "account": "webull",
      "broker": "webull",
      "symbol": "QXRB",
      "underlying": "QXRB",
      "instrument": "stock",
      "leverage": 1,
      "direction": "long",
      "style": "day",
      "sameDay": true,
      "openedAt": "2025-03-11T09:30:01-04:00",
      "closedAt": "2025-03-11T09:31:00-04:00",
      "status": "closed",
      "maxPosition": 2,
      "openQty": 0,
      "unmatchedQty": 0,
      "avgEntry": 2.1,
      "avgExit": 2.2,
      "grossPnl": 0.2,
      "fees": 0,
      "netPnl": 0.2,
      "result": "win",
      "holdMinutes": 0.98,
      "fillIds": [
        "wb-6a72f40d4a17",
        "wb-737a438049f8",
        "wb-217057244bd4"
      ],
      "avgCost": 2.1,
      "realizedPnl": 0.2,
      "events": [
        {
          "kind": "open",
          "at": "2025-03-11T09:30:01-04:00",
          "qty": 1,
          "price": 2.1
        },
        {
          "kind": "add",
          "at": "2025-03-11T09:30:01-04:00",
          "qty": 1,
          "price": 2.1
        },
        {
          "kind": "close",
          "at": "2025-03-11T09:31:00-04:00",
          "qty": 2,
          "price": 2.2,
          "realized": 0.2
        }
      ],
      "tags": [],
      "excluded": false
    },